tweet_id,timestamp,text,rating_numerator,rating_denominator,name,dog_stages,jpg_url,favorite_count,retweet_count,source,url,dog_breed
892420643555336193,2017-08-01 16:23:56,This is Phineas. He's a mystical boy. Only ever appears in the hole of a donut. 13/10 https://t.co/MgUWQ76dJU,13.0,10.0,Phineas,None,https://pbs.twimg.com/media/DGKD1-bXoAAIAUK.jpg,33636,6961,Twitter for iPhone,https://t.co/MgUWQ76dJU,None
892177421306343426,2017-08-01 00:17:27,"This is Tilly. She's just checking pup on you. Hopes you're doing ok. If not, she's available for pats, snugs, boops, the whole bit. 13/10 https://t.co/0Xxu71qeIV",13.0,10.0,Tilly,None,https://pbs.twimg.com/media/DGGmoV4XsAAUL6n.jpg,29179,5265,Twitter for iPhone,https://t.co/0Xxu71qeIV,Chihuahua
891815181378084864,2017-07-31 00:18:03,This is Archie. He is a rare Norwegian Pouncing Corgo. Lives in the tall grass. You never know when one may strike. 12/10 https://t.co/wUnZnhtVJB,12.0,10.0,Archie,None,https://pbs.twimg.com/media/DGBdLU1WsAANxJ9.jpg,21948,3463,Twitter for iPhone,https://t.co/wUnZnhtVJB,Chihuahua
891689557279858688,2017-07-30 15:58:51,This is Darla. She commenced a snooze mid meal. 13/10 happens to the best of us https://t.co/tD36da7qLQ,13.0,10.0,Darla,None,https://pbs.twimg.com/media/DF_q7IAWsAEuuN8.jpg,36708,7175,Twitter for iPhone,https://t.co/tD36da7qLQ,Labrador_retriever
891327558926688256,2017-07-29 16:00:24,"This is Franklin. He would like you to stop calling him ""cute."" He is a very fierce shark and should be respected as such. 12/10 #BarkWeek https://t.co/AtUZn91f7f",12.0,10.0,Franklin,None,https://pbs.twimg.com/media/DF6hr6BUMAAzZgT.jpg,35103,7707,Twitter for iPhone,https://t.co/AtUZn91f7f,basset
891087950875897856,2017-07-29 00:08:17,Here we have a majestic great white breaching off South Africa's coast. Absolutely h*ckin breathtaking. 13/10 (IG: tucker_marlo) #BarkWeek https://t.co/kQ04fDDRmh,13.0,10.0,None,None,https://pbs.twimg.com/media/DF3HwyEWsAABqE6.jpg,17704,2580,Twitter for iPhone,https://t.co/kQ04fDDRmh,Chesapeake_Bay_retriever
890971913173991426,2017-07-28 16:27:12,"Meet Jax. He enjoys ice cream so much he gets nervous around it. 13/10 help Jax enjoy more things by clicking below

https://t.co/Zr4hWfAs1H https://t.co/tVJBRMnhxl",13.0,10.0,Jax,None,https://pbs.twimg.com/media/DF1eOmZXUAALUcq.jpg,10307,1644,Twitter for iPhone,https://t.co/Zr4hWfAs1H https://t.co/tVJBRMnhxl,Appenzeller
890729181411237888,2017-07-28 00:22:40,When you watch your owner call another dog a good boy but then they turn back to you and say you're a great boy. 13/10 https://t.co/v0nONBcwxq,13.0,10.0,None,None,https://pbs.twimg.com/media/DFyBahAVwAAhUTd.jpg,56542,15664,Twitter for iPhone,https://t.co/v0nONBcwxq,Pomeranian
890609185150312448,2017-07-27 16:25:51,This is Zoey. She doesn't want to be one of the scary sharks. Just wants to be a snuggly pettable boatpet. 13/10 #BarkWeek https://t.co/9TwLuAGH0b,13.0,10.0,Zoey,None,https://pbs.twimg.com/media/DFwUU__XcAEpyXI.jpg,24386,3599,Twitter for iPhone,https://t.co/9TwLuAGH0b,Irish_terrier
890240255349198849,2017-07-26 15:59:51,This is Cassie. She is a college pup. Studying international doggo communication and stick theory. 14/10 so elegant much sophisticate https://t.co/t1bfwz5S2A,14.0,10.0,Cassie,Doggo,https://pbs.twimg.com/media/DFrEyVuW0AAO3t9.jpg,27800,6059,Twitter for iPhone,https://t.co/t1bfwz5S2A,Pembroke
890006608113172480,2017-07-26 00:31:25,This is Koda. He is a South Australian deckshark. Deceptively deadly. Frighteningly majestic. 13/10 would risk a petting #BarkWeek https://t.co/dVPW0B0Mme,13.0,10.0,Koda,None,https://pbs.twimg.com/media/DFnwSY4WAAAMliS.jpg,26899,6105,Twitter for iPhone,https://t.co/dVPW0B0Mme,Samoyed
889880896479866881,2017-07-25 16:11:53,This is Bruno. He is a service shark. Only gets out of the water to assist you. 13/10 terrifyingly good boy https://t.co/u1XPQMl29g,13.0,10.0,Bruno,None,https://pbs.twimg.com/media/DFl99B1WsAITKsg.jpg,24440,4136,Twitter for iPhone,https://t.co/u1XPQMl29g,French_bulldog
889665388333682689,2017-07-25 01:55:32,Here's a puppo that seems to be on the fence about something haha no but seriously someone help her. 13/10 https://t.co/BxvuXk0UCm,13.0,10.0,None,Puppo,https://pbs.twimg.com/media/DFi579UWsAAatzw.jpg,41792,8293,Twitter for iPhone,https://t.co/BxvuXk0UCm,Pembroke
889638837579907072,2017-07-25 00:10:02,This is Ted. He does his best. Sometimes that's not enough. But it's ok. 12/10 would assist https://t.co/f8dEDcrKSR,12.0,10.0,Ted,None,https://pbs.twimg.com/media/DFihzFfXsAYGDPR.jpg,23533,3695,Twitter for iPhone,https://t.co/f8dEDcrKSR,French_bulldog
889531135344209921,2017-07-24 17:02:04,This is Stuart. He's sporting his favorite fanny pack. Secretly filled with bones only. 13/10 puppared puppo #BarkWeek https://t.co/y70o6h3isq,13.0,10.0,Stuart,Puppo,https://pbs.twimg.com/media/DFg_2PVW0AEHN3p.jpg,13282,1873,Twitter for iPhone,https://t.co/y70o6h3isq,golden_retriever
889278841981685760,2017-07-24 00:19:32,This is Oliver. You're witnessing one of his many brutal attacks. Seems to be playing with his victim. 13/10 fr*ckin frightening #BarkWeek https://t.co/WpHvrQedPb,13.0,10.0,Oliver,None,https://pbs.twimg.com/ext_tw_video_thumb/889278779352338437/pu/img/VlbFB3v8H8VwzVNY.jpg,21964,4414,Twitter for iPhone,https://t.co/WpHvrQedPb,whippet
888917238123831296,2017-07-23 00:22:39,This is Jim. He found a fren. Taught him how to sit like the good boys. 12/10 for both https://t.co/chxruIOUJN,12.0,10.0,Jim,None,https://pbs.twimg.com/media/DFYRgsOUQAARGhO.jpg,25475,3739,Twitter for iPhone,https://t.co/chxruIOUJN,golden_retriever
888804989199671297,2017-07-22 16:56:37,This is Zeke. He has a new stick. Very proud of it. Would like you to throw it for him without taking it. 13/10 would do my best https://t.co/HTQ77yNQ5K,13.0,10.0,Zeke,None,https://pbs.twimg.com/media/DFWra-3VYAA2piG.jpg,22345,3508,Twitter for iPhone,https://t.co/HTQ77yNQ5K,golden_retriever
888554962724278272,2017-07-22 00:23:06,This is Ralphus. He's powering up. Attempting maximum borkdrive. 13/10 inspirational af https://t.co/YnYAFCTTiK,13.0,10.0,Ralphus,None,https://pbs.twimg.com/media/DFTH_O-UQAACu20.jpg,17225,2859,Twitter for iPhone,https://t.co/YnYAFCTTiK,Siberian_husky
888078434458587136,2017-07-20 16:49:33,This is Gerald. He was just told he didn't get the job he interviewed for. A h*ckin injustice. 12/10 didn't want the job anyway https://t.co/DK7iDPfuRX,12.0,10.0,Gerald,None,https://pbs.twimg.com/media/DFMWn56WsAAkA7B.jpg,19068,2881,Twitter for iPhone,https://t.co/DK7iDPfuRX,French_bulldog
887705289381826560,2017-07-19 16:06:48,This is Jeffrey. He has a monopoly on the pool noodles. Currently running a 'boop for two' midweek sale. 13/10 h*ckin strategic https://t.co/PhrUk20Q64,13.0,10.0,Jeffrey,None,https://pbs.twimg.com/media/DFHDQBbXgAEqY7t.jpg,26471,4513,Twitter for iPhone,https://t.co/PhrUk20Q64,basset
887517139158093824,2017-07-19 03:39:09,I've yet to rate a Venezuelan Hover Wiener. This is such an honor. 14/10 paw-inspiring af (IG: roxy.thedoxy) https://t.co/20VrLAA8ba,14.0,10.0,None,None,https://pbs.twimg.com/ext_tw_video_thumb/887517108413886465/pu/img/WanJKwssZj4VJvL9.jpg,40502,9801,Twitter for iPhone,https://t.co/20VrLAA8ba,None
887473957103951883,2017-07-19 00:47:34,This is Canela. She attempted some fancy porch pics. They were unsuccessful. 13/10 someone help her https://t.co/cLyzpcUcMX,13.0,10.0,Canela,None,https://pbs.twimg.com/media/DFDw2tyUQAAAFke.jpg,59859,14940,Twitter for iPhone,https://t.co/cLyzpcUcMX,Pembroke
887343217045368832,2017-07-18 16:08:03,You may not have known you needed to see this today. 13/10 please enjoy (IG: emmylouroo) https://t.co/WZqNqygEyV,13.0,10.0,None,None,https://pbs.twimg.com/ext_tw_video_thumb/887343120832229379/pu/img/6HSuFrW1lzI_9Mht.jpg,29429,8766,Twitter for iPhone,https://t.co/WZqNqygEyV,Mexican_hairless
887101392804085760,2017-07-18 00:07:08,This... is a Jubilant Antarctic House Bear. We only rate dogs. Please only send dogs. Thank you... 12/10 would suffocate in floof https://t.co/4Ad1jzJSdp,12.0,10.0,None,None,https://pbs.twimg.com/media/DE-eAq6UwAA-jaE.jpg,26841,4965,Twitter for iPhone,https://t.co/4Ad1jzJSdp,Samoyed
886983233522544640,2017-07-17 16:17:36,This is Maya. She's very shy. Rarely leaves her cup. 13/10 would find her an environment to thrive in https://t.co/I6oNy0CgiT,13.0,10.0,Maya,None,https://pbs.twimg.com/media/DE8yicJW0AAAvBJ.jpg,30189,6280,Twitter for iPhone,https://t.co/I6oNy0CgiT,Chihuahua
886736880519319552,2017-07-16 23:58:41,"This is Mingus. He's a wonderful father to his smol pup. Confirmed 13/10, but he needs your help

https://t.co/bVi0Yr4Cff https://t.co/ISvKOSkd5b",13.0,10.0,Mingus,None,https://pbs.twimg.com/media/DE5Se8FXcAAJFx4.jpg,10447,2609,Twitter for iPhone,https://t.co/bVi0Yr4Cff https://t.co/ISvKOSkd5b,kuvasz
886680336477933568,2017-07-16 20:14:00,This is Derek. He's late for a dog meeting. 13/10 pet...al to the metal https://t.co/BCoWue0abA,13.0,10.0,Derek,None,https://pbs.twimg.com/media/DE4fEDzWAAAyHMM.jpg,19622,3717,Twitter for iPhone,https://t.co/BCoWue0abA,None
886366144734445568,2017-07-15 23:25:31,This is Roscoe. Another pupper fallen victim to spontaneous tongue ejections. Get the BlepiPen immediate. 12/10 deep breaths Roscoe https://t.co/RGE08MIJox,12.0,10.0,Roscoe,Pupper,https://pbs.twimg.com/media/DE0BTnQUwAApKEH.jpg,18454,2609,Twitter for iPhone,https://t.co/RGE08MIJox,French_bulldog
886258384151887873,2017-07-15 16:17:19,This is Waffles. His doggles are pupside down. Unsure how to fix. 13/10 someone assist Waffles https://t.co/xZDA9Qsq1O,13.0,10.0,Waffles,None,https://pbs.twimg.com/media/DEyfTG4UMAE4aE9.jpg,24400,5244,Twitter for iPhone,https://t.co/xZDA9Qsq1O,pug
885984800019947520,2017-07-14 22:10:11,Viewer discretion advised. This is Jimbo. He will rip ur finger right h*ckin off. Other dog clearly an accessory. 12/10 pls pet with caution https://t.co/BuveP0uMF1,12.0,10.0,Jimbo,None,https://pbs.twimg.com/media/DEumeWWV0AA-Z61.jpg,28442,5585,Twitter for iPhone,https://t.co/BuveP0uMF1,Blenheim_spaniel
885528943205470208,2017-07-13 15:58:47,This is Maisey. She fell asleep mid-excavation. Happens to the best of us. 13/10 would pat noggin approvingly https://t.co/tp1kQ8i9JF,13.0,10.0,Maisey,None,https://pbs.twimg.com/media/DEoH3yvXgAAzQtS.jpg,31424,5303,Twitter for iPhone,https://t.co/tp1kQ8i9JF,pug
885167619883638784,2017-07-12 16:03:00,Here we have a corgi undercover as a malamute. Pawbably doing important investigative work. Zero control over tongue happenings. 13/10 https://t.co/44ItaMubBf,13.0,10.0,None,None,https://pbs.twimg.com/media/DEi_N9qXYAAgEEw.jpg,19147,3649,Twitter for iPhone,https://t.co/44ItaMubBf,malamute
884925521741709313,2017-07-12 00:01:00,"This is Earl. He found a hat. Nervous about what you think of it. 12/10 it's delightful, Earl https://t.co/MYJvdlNRVa",12.0,10.0,Earl,None,https://pbs.twimg.com/media/DEfjEaNXkAAtPlj.jpg,66804,14924,Twitter for iPhone,https://t.co/MYJvdlNRVa,Italian_greyhound
884876753390489601,2017-07-11 20:47:12,This is Lola. It's her first time outside. Must test the earth and taste the atmosphere. 13/10 you're doing great Lola https://t.co/74TKAUsLkO,13.0,10.0,Lola,None,https://pbs.twimg.com/media/DEe2tZXXkAAwyX3.jpg,24254,4634,Twitter for iPhone,https://t.co/74TKAUsLkO,chow
884562892145688576,2017-07-11 00:00:02,This is Kevin. He's just so happy. 13/10 what is your secret Kevin https://t.co/1r4MFCbCX5,13.0,10.0,Kevin,None,https://pbs.twimg.com/media/DEaZQkfXUAEC7qB.jpg,21192,3891,Twitter for iPhone,https://t.co/1r4MFCbCX5,pug
884441805382717440,2017-07-10 15:58:53,"I present to you, Pup in Hat. Pup in Hat is great for all occasions. Extremely versatile. Compact as h*ck. 14/10 (IG: itselizabethgales) https://t.co/vvBOcC2VdC",14.0,10.0,None,None,https://pbs.twimg.com/media/DEYrIZwWsAA2Wo5.jpg,23749,4773,Twitter for iPhone,https://t.co/vvBOcC2VdC,Pembroke
884162670584377345,2017-07-09 21:29:42,Meet Yogi. He doesn't have any important dog meetings today he just enjoys looking his best at all times. 12/10 for dangerously dapper doggo https://t.co/YSI00BzTBZ,12.0,10.0,Yogi,Doggo,https://pbs.twimg.com/media/DEUtQbzW0AUTv_o.jpg,17848,2493,Twitter for iPhone,https://t.co/YSI00BzTBZ,German_shepherd
883838122936631299,2017-07-09 00:00:04,This is Noah. He can't believe someone made this mess. Got the vacuum out for you though. Offered to help clean pup. 12/10 super good boy https://t.co/V85xujjDDY,12.0,10.0,Noah,None,https://pbs.twimg.com/media/DEQGFgAXUAAEvfi.jpg,19044,2847,Twitter for iPhone,https://t.co/V85xujjDDY,Doberman
883482846933004288,2017-07-08 00:28:19,"This is Bella. She hopes her smile made you smile. If not, she is also offering you her favorite monkey. 13.5/10 https://t.co/qjrljjt948",13.5,10.0,Bella,None,https://pbs.twimg.com/media/DELC9dZXUAADqUk.jpg,39978,8211,Twitter for iPhone,https://t.co/qjrljjt948,golden_retriever
883360690899218434,2017-07-07 16:22:55,Meet Grizzwald. He may be the floofiest floofer I ever did see. Lost eyes saving a schoolbus from a volcano erpuption. 13/10 heroic as h*ck https://t.co/rf661IFEYP,13.0,10.0,Grizzwald,Floofer,https://pbs.twimg.com/media/DEJT3FeXoAAtwUy.jpg,19836,3059,Twitter for iPhone,https://t.co/rf661IFEYP,chow
883117836046086144,2017-07-07 00:17:54,"Please only send dogs. We don't rate mechanics, no matter how h*ckin good. Thank you... 13/10 would sneak a pat https://t.co/Se5fZ9wp5E",13.0,10.0,None,None,https://pbs.twimg.com/media/DEF2-_hXoAAs62q.jpg,32325,5506,Twitter for iPhone,https://t.co/Se5fZ9wp5E,golden_retriever
882992080364220416,2017-07-06 15:58:11,This is Rusty. He wasn't ready for the first pic. Clearly puppared for the second. 13/10 confirmed great boy https://t.co/tyER0KpdXj,13.0,10.0,Rusty,None,https://pbs.twimg.com/media/DEEEnIqXYAAiJh_.jpg,20866,3225,Twitter for iPhone,https://t.co/tyER0KpdXj,Eskimo_dog
882762694511734784,2017-07-06 00:46:41,This is Gus. He's quite the cheeky pupper. Already perfected the disinterested wink. 12/10 would let steal my girl https://t.co/D43I96SlVu,12.0,10.0,Gus,Pupper,https://pbs.twimg.com/media/DEAz_HHXsAA-p_z.jpg,24647,4071,Twitter for iPhone,https://t.co/D43I96SlVu,Labrador_retriever
882627270321602560,2017-07-05 15:48:34,This is Stanley. He has his first swim lesson today. Doggle straps adjusted. Ready to go. 13/10 Phelps is nervous (IG: stanleythe_corgi) https://t.co/Nx52PGwH94,13.0,10.0,Stanley,None,https://pbs.twimg.com/media/DD-40X3WAAAJPU5.jpg,24480,5036,Twitter for iPhone,https://t.co/Nx52PGwH94,Pembroke
882268110199369728,2017-07-04 16:01:23,This is Alfy. You're witnessing his first watermelon experience. I think it was a success. 13/10 happy 4th Alfy ðŸ‡ºðŸ‡¸ https://t.co/fYP5RlutfA,13.0,10.0,Alfy,None,https://pbs.twimg.com/media/DD5yKdPW0AArzX8.jpg,38973,9569,Twitter for iPhone,https://t.co/fYP5RlutfA,golden_retriever
882045870035918850,2017-07-04 01:18:17,"This is Koko. Her owner, inspired by Barney, recently built a cart for her to use during walks if she got tired. 13/10 rest easy Koko https://t.co/zeDpnsKX7w",13.0,10.0,Koko,None,https://pbs.twimg.com/media/DD2oCl2WAAEI_4a.jpg,25572,4061,Twitter for iPhone,https://t.co/zeDpnsKX7w,golden_retriever
881906580714921986,2017-07-03 16:04:48,This is Rey. He's a Benebop Cumberfloof. 12/10 dangerously pettable https://t.co/503CgWbhxQ,12.0,10.0,Rey,None,https://pbs.twimg.com/media/DD0pWm9XcAAeSBL.jpg,21335,2837,Twitter for iPhone,https://t.co/503CgWbhxQ,Weimaraner
881666595344535552,2017-07-03 00:11:11,This is Gary. He couldn't miss this puppertunity for a selfie. Flawless focusing skills. 13/10 would boop intensely https://t.co/7CSWCl8I6s,13.0,10.0,Gary,None,https://pbs.twimg.com/media/DDxPFwbWAAEbVVR.jpg,44291,8902,Twitter for iPhone,https://t.co/7CSWCl8I6s,Saluki
881536004380872706,2017-07-02 15:32:16,"Here is a pupper approaching maximum borkdrive. Zooming at never before seen speeds. 14/10 paw-inspiring af 
(IG: puffie_the_chow) https://t.co/ghXBIIeQZF",14.0,10.0,None,Pupper,https://pbs.twimg.com/ext_tw_video_thumb/881535971568889856/pu/img/9bawiZ--8FKywTkz.jpg,43211,13331,Twitter for iPhone,https://t.co/ghXBIIeQZF,Samoyed
881268444196462592,2017-07-01 21:49:04,Meet Elliot. He's a Canadian Forrest Pup. Unusual number of antlers for a dog. Sneaky tongue slip to celebrate #Canada150. 12/10 would pet https://t.co/cgwJwowTMC,12.0,10.0,Elliot,None,https://pbs.twimg.com/media/DDrk-f9WAAI-WQv.jpg,20395,4476,Twitter for iPhone,https://t.co/cgwJwowTMC,None
880935762899988482,2017-06-30 23:47:07,This is Louis. He's crossing. It's a big deal. 13/10 h*ckin breathtaking https://t.co/D0wb1GlKAt,13.0,10.0,Louis,None,https://pbs.twimg.com/media/DDm2Z5aXUAEDS2u.jpg,14972,2325,Twitter for iPhone,https://t.co/D0wb1GlKAt,None
880872448815771648,2017-06-30 19:35:32,Ugh not again. We only rate dogs. Please don't send in well-dressed  floppy-tongued street penguins. Dogs only please. Thank you... 12/10 https://t.co/WiAMbTkDPf,12.0,10.0,None,None,https://pbs.twimg.com/media/DDl8zzJW0AAisCJ.jpg,18604,3189,Twitter for iPhone,https://t.co/WiAMbTkDPf,Pembroke
880465832366813184,2017-06-29 16:39:47,This is Bella. She had her first beach experience this morning. Complete success. 12/10 would perform a sandy boop https://t.co/4VsFysDmiw,12.0,10.0,Bella,None,https://pbs.twimg.com/media/DDgK-J4XUAIEV9W.jpg,24883,5185,Twitter for iPhone,https://t.co/4VsFysDmiw,golden_retriever
880221127280381952,2017-06-29 00:27:25,Meet Jesse. He's a Fetty Woof. His tongue ejects without warning. A true bleptomaniac. 12/10 would snug well https://t.co/fUod0tVmvK,12.0,10.0,Jesse,None,https://pbs.twimg.com/media/DDcscbXU0AIfDzs.jpg,23528,3443,Twitter for iPhone,https://t.co/fUod0tVmvK,Chihuahua
880095782870896641,2017-06-28 16:09:20,Please don't send in photos without dogs in them. We're not @porch_rates. Insubordinate and churlish. Pretty good porch tho 11/10 https://t.co/HauE8M3Bu4,11.0,10.0,None,None,https://pbs.twimg.com/media/DDa6ckbXgAAM1vV.jpg,24189,3633,Twitter for iPhone,https://t.co/HauE8M3Bu4,miniature_pinscher
879862464715927552,2017-06-28 00:42:13,This is Romeo. He would like to do an entrance. Requesting your immediate assistance. 13/10 https://t.co/Qh5aEkRQm9,13.0,10.0,Romeo,None,https://pbs.twimg.com/media/DDXmPrbWAAEKMvy.jpg,19605,2912,Twitter for iPhone,https://t.co/Qh5aEkRQm9,basset
879492040517615616,2017-06-27 00:10:17,This is Bailey. He thinks you should measure ear length for signs of growth instead. 12/10 https://t.co/IxM9IMKQq8,12.0,10.0,Bailey,None,https://pbs.twimg.com/media/DDSVWMvXsAEgmMK.jpg,20599,2617,Twitter for iPhone,https://t.co/IxM9IMKQq8,German_short-haired_pointer
879415818425184262,2017-06-26 19:07:24,This is Duddles. He did an attempt. 13/10 someone help him (vid by Georgia Felici) https://t.co/UDT7ZkcTgY,13.0,10.0,Duddles,None,https://pbs.twimg.com/ext_tw_video_thumb/879415784908390401/pu/img/cX7XI1TnUsseGET5.jpg,92310,37169,Twitter for iPhone,https://t.co/UDT7ZkcTgY,English_springer
879376492567855104,2017-06-26 16:31:08,This is Jack AKA Stephen Furry. You're not scoring on him. Unless he slips down the slide. 12/10 would happily get blocked by https://t.co/0gOi601EAa,12.0,10.0,Jack,None,https://pbs.twimg.com/media/DDQsQGFV0AAw6u9.jpg,14765,2632,Twitter for iPhone,https://t.co/0gOi601EAa,Labrador_retriever
879050749262655488,2017-06-25 18:56:45,This is Steven. He has trouble relating to other dogs. Quite shy. Neck longer than average. Tropical probably. 11/10 would still pet https://t.co/2mJCDEJWdD,11.0,10.0,Steven,None,https://pbs.twimg.com/media/DDMD_phXoAQ1qf0.jpg,19704,3930,Twitter for iPhone,https://t.co/2mJCDEJWdD,None
879008229531029506,2017-06-25 16:07:47,This is Beau. That is Beau's balloon. He takes it everywhere. 13/10 would protect at all costs https://t.co/YDtpCjIPKN,13.0,10.0,Beau,None,https://pbs.twimg.com/media/DDLdUrqXYAMOVzY.jpg,16683,2230,Twitter for iPhone,https://t.co/YDtpCjIPKN,vizsla
878776093423087618,2017-06-25 00:45:22,This is Snoopy. He's a proud #PrideMonthPuppo. Impeccable handwriting for not having thumbs. 13/10 would love back #PrideMonth https://t.co/lNZwgNO4gS,13.0,10.0,Snoopy,Puppo,https://pbs.twimg.com/media/DDIKMXzW0AEibje.jpg,17055,3414,Twitter for iPhone,https://t.co/lNZwgNO4gS,Italian_greyhound
878281511006478336,2017-06-23 16:00:04,"Meet Shadow. In an attempt to reach maximum zooming borkdrive, he tore his ACL. Still 13/10 tho. Help him out below

https://t.co/245xJJElsY https://t.co/lUiQH219v6",13.0,10.0,Shadow,None,https://pbs.twimg.com/media/DDBIX9QVYAAohGa.jpg,6744,1066,Twitter for iPhone,https://t.co/245xJJElsY https://t.co/lUiQH219v6,basset
878057613040115712,2017-06-23 01:10:23,This is Emmy. She was adopted today. Massive round of pupplause for Emmy and her new family. 14/10 for all involved https://t.co/cwtWnHMVpe,14.0,10.0,Emmy,None,https://pbs.twimg.com/media/DC98vABUIAA97pz.jpg,36952,5704,Twitter for iPhone,https://t.co/cwtWnHMVpe,French_bulldog
877736472329191424,2017-06-22 03:54:17,This is Aja. She was just told she's a good dog. Suspicions confirmed. 13/10 would tell again https://t.co/lsPyyAiF1r,13.0,10.0,Aja,None,https://pbs.twimg.com/media/DC5YqoQW0AArOLH.jpg,68842,15710,Twitter for iPhone,https://t.co/lsPyyAiF1r,Chesapeake_Bay_retriever
877556246731214848,2017-06-21 15:58:08,This is Penny. She's both pupset and fired pup. Not pleased w your barbaric attempts at cleanliness. 12/10 would enjoy more shampoo options https://t.co/OYdDlfOGXP,12.0,10.0,Penny,None,https://pbs.twimg.com/media/DC20wEcW0AAf59m.jpg,19798,3147,Twitter for iPhone,https://t.co/OYdDlfOGXP,basset
877316821321428993,2017-06-21 00:06:44,"Meet Dante. At first he wasn't a fan of his new raincoat, then he saw his reflection. H*ckin handsome. 13/10 for water resistant good boy https://t.co/SHRTIo5pxc",13.0,10.0,Dante,None,https://pbs.twimg.com/media/DCza_vtXkAQXGpC.jpg,24025,4318,Twitter for iPhone,https://t.co/SHRTIo5pxc,Saluki
877201837425926144,2017-06-20 16:29:50,This is Nelly. He graduated with his dogtorate today. Wants to know if you're proud of him. 12/10 would give congratulatory boop https://t.co/4g4cfj3P4Y,12.0,10.0,Nelly,None,https://pbs.twimg.com/media/DCxyahJWsAAddSC.jpg,23753,4599,Twitter for iPhone,https://t.co/4g4cfj3P4Y,Pembroke
876838120628539392,2017-06-19 16:24:33,This is Ginger. She's having a ruff Monday. Too many pupper things going on. H*ckin exhausting. 12/10 would snug passionately https://t.co/j211oCDRs6,12.0,10.0,Ginger,Pupper,https://pbs.twimg.com/media/DCsnnZsVwAEfkyi.jpg,18131,2792,Twitter for iPhone,https://t.co/j211oCDRs6,bloodhound
876484053909872640,2017-06-18 16:57:37,This is Benedict. He wants to thank you for this delightful urban walk. Hopes you know he loves you. 13/10 super duper good boy https://t.co/26BXueUgbs,13.0,10.0,Benedict,None,https://pbs.twimg.com/media/DCnll_dUQAAkBdG.jpg,16486,1987,Twitter for iPhone,https://t.co/26BXueUgbs,golden_retriever
876120275196170240,2017-06-17 16:52:05,"Meet Venti, a seemingly caffeinated puppoccino. She was just informed the weekend would include walks, pats and scritches. 13/10 much excite https://t.co/ejExJFq3ek",13.0,10.0,Venti,None,https://pbs.twimg.com/media/DCiavj_UwAAcXep.jpg,24570,3885,Twitter for iPhone,https://t.co/ejExJFq3ek,Bernese_mountain_dog
875747767867523072,2017-06-16 16:11:53,"This is Goose. He's a womanizer. Cheeky as h*ck, but also deep. Tongue slip game on another level. 13/10 will steal your girl https://t.co/V2WlACRJCN",13.0,10.0,Goose,None,https://pbs.twimg.com/media/DCdH8YpUQAAiEbL.jpg,21986,3559,Twitter for iPhone,https://t.co/V2WlACRJCN,Labrador_retriever
875144289856114688,2017-06-15 00:13:52,Meet Nugget and Hank. Nugget took Hank's bone. Hank is wondering if you would please return it to him. Both 13/10 would not intervene https://t.co/ogith9ejNj,13.0,10.0,Nugget,None,https://pbs.twimg.com/ext_tw_video_thumb/875144175078957056/pu/img/BRi_l7vUdpb93Knf.jpg,19328,4130,Twitter for iPhone,https://t.co/ogith9ejNj,Siberian_husky
875021211251597312,2017-06-14 16:04:48,Guys please stop sending pictures without any dogs in th- oh never mind hello excuse me sir. 12/10 stealthy as h*ck https://t.co/brCQoqc8AW,12.0,10.0,None,None,https://pbs.twimg.com/media/DCSzF3NVoAAPzT4.jpg,22452,3951,Twitter for iPhone,https://t.co/brCQoqc8AW,West_Highland_white_terrier
874680097055178752,2017-06-13 17:29:20,Meet Cash. He hath acquired a stick. A very good stick tbh. 12/10 would pat head approvingly https://t.co/lZhtizkURD,12.0,10.0,Cash,None,https://pbs.twimg.com/media/DCN85nGUwAAzG_q.jpg,24464,3902,Twitter for iPhone,https://t.co/lZhtizkURD,Labrador_retriever
874296783580663808,2017-06-12 16:06:11,This is Jed. He may be the fanciest pupper in the game right now. Knows it too. 13/10 would sign modeling contract https://t.co/0YplNnSMEm,13.0,10.0,Jed,Pupper,https://pbs.twimg.com/media/DCIgSR0XgAANEOY.jpg,22849,3464,Twitter for iPhone,https://t.co/0YplNnSMEm,cocker_spaniel
874057562936811520,2017-06-12 00:15:36,"I can't believe this keeps happening. This, is a birb taking a bath. We only rate dogs. Please only send dogs. Thank you... 12/10 https://t.co/pwY9PQhtP2",12.0,10.0,None,None,https://pbs.twimg.com/media/DCFGtdoXkAEsqIw.jpg,20031,3364,Twitter for iPhone,https://t.co/pwY9PQhtP2,flat-coated_retriever
874012996292530176,2017-06-11 21:18:31,"This is Sebastian. He can't see all the colors of the rainbow, but he can see that this flag makes his human happy. 13/10 #PrideMonth puppo https://t.co/XBE0evJZ6V",13.0,10.0,Sebastian,Puppo,https://pbs.twimg.com/media/DCEeLxjXsAAvNSM.jpg,29976,8539,Twitter for iPhone,https://t.co/XBE0evJZ6V,Cardigan
873580283840344065,2017-06-10 16:39:04,"We usually don't rate Deck-bound Saskatoon Black Bears, but this one is h*ckin flawless. Sneaky tongue slip too. 13/10 would hug firmly https://t.co/mNuMH9400n",13.0,10.0,None,None,https://pbs.twimg.com/media/DB-UotKXkAEHXVi.jpg,21277,3331,Twitter for iPhone,https://t.co/mNuMH9400n,Newfoundland
