tweet_id,timestamp,text,rating_numerator,rating_denominator,name,dog_stages,jpg_url,favorite_count,retweet_count,source,url,dog_breed
820749716845686786,2017-01-15 21:49:15,Meet Sunny. He can take down a polar bear in one fell swoop. Fr*cken deadly af. 13/10 would pet with caution https://t.co/EMq8Ud6Ze1,13.0,10.0,Sunny,None,https://pbs.twimg.com/media/C2PjgjQXcAAc4Uu.jpg,29667,9142,Twitter for iPhone,https://t.co/EMq8Ud6Ze1,golden_retriever
820690176645140481,2017-01-15 17:52:40,The floofs have been released I repeat the floofs have been released. 84/70 https://t.co/NIYC820tmd,84.0,70.0,None,None,https://pbs.twimg.com/media/C2OtWr0VQAEnS9r.jpg,11533,2987,Twitter for iPhone,https://t.co/NIYC820tmd,West_Highland_white_terrier
820314633777061888,2017-01-14 17:00:24,"We are proud to support @LoveYourMelon on their mission to put a hat on every kid battling cancer. They are 14/10

https://t.co/XQlmPTLHPl https://t.co/ZNIkkHgtYE",14.0,10.0,None,None,https://pbs.twimg.com/media/C2JXyARUAAE4gbL.jpg,3145,521,Twitter for iPhone,https://t.co/XQlmPTLHPl https://t.co/ZNIkkHgtYE,Gordon_setter
820078625395449857,2017-01-14 01:22:35,I've never wanted to go to a camp more in my entire life. 12/10 for all on board https://t.co/wJZlpGFEbD,12.0,10.0,None,None,https://pbs.twimg.com/media/C2GBJADWIAQvcNb.jpg,18540,5751,Twitter for iPhone,https://t.co/wJZlpGFEbD,None
819952236453363712,2017-01-13 17:00:21,"This is Oliver. He has dreams of being a service puppo so he can help his owner. 13/10 selfless af

make it happen:
https://t.co/f5WMsx0a9K https://t.co/6lJz0DKZIb",13.0,10.0,Oliver,Puppo,https://pbs.twimg.com/media/C2EONHNWQAUWxkP.jpg,4996,1077,Twitter for iPhone,https://t.co/f5WMsx0a9K https://t.co/6lJz0DKZIb,American_Staffordshire_terrier
819924195358416896,2017-01-13 15:08:56,Here we have a doggo who has messed up. He was hoping you wouldn't notice. 11/10 someone help him https://t.co/XdRNXNYD4E,11.0,10.0,None,Doggo,https://pbs.twimg.com/ext_tw_video_thumb/819924138965999617/pu/img/6OIToyT9eLESHXLU.jpg,12178,4518,Twitter for iPhone,https://t.co/XdRNXNYD4E,None
819711362133872643,2017-01-13 01:03:12,This is Howie. He just bloomed. 11/10 revolutionary af https://t.co/m5fYxrO3IU,11.0,10.0,Howie,None,https://pbs.twimg.com/media/C2AzHjQWQAApuhf.jpg,12542,2848,Twitter for iPhone,https://t.co/m5fYxrO3IU,toy_poodle
819588359383371776,2017-01-12 16:54:26,This is Jazzy. She just found out that sandwich wasn't for her. Shocked and puppalled. 13/10 deep breaths Jazzy https://t.co/52cItP0vIO,13.0,10.0,Jazzy,None,https://pbs.twimg.com/media/C1_DQn3UoAIoJy7.jpg,9112,1863,Twitter for iPhone,https://t.co/52cItP0vIO,Cardigan
819347104292290561,2017-01-12 00:55:47,Say hello to Anna and Elsa. They fall asleep in similar positions. It's pretty wild. Both 12/10 would snug simultaneously https://t.co/8rUL99bX4W,12.0,10.0,Anna,None,https://pbs.twimg.com/media/C17n1nrWQAIErU3.jpg,6793,1115,Twitter for iPhone,https://t.co/8rUL99bX4W,Rottweiler
819227688460238848,2017-01-11 17:01:16,This is Finn. He's wondering if you come here often. Fr*ckin flirtatious af. 12/10 would give number to https://t.co/ii5eNX5LJT,12.0,10.0,Finn,None,https://pbs.twimg.com/media/C157Oq3WQAEOyHm.jpg,21688,6203,Twitter for iPhone,https://t.co/ii5eNX5LJT,Border_terrier
819006400881917954,2017-01-11 02:21:57,This is Sunny. She was also a very good First Doggo. 14/10 would also be an absolute honor to pet https://t.co/YOC1fHFCSb,14.0,10.0,Sunny,Doggo,https://pbs.twimg.com/media/C12x-JTVIAAzdfl.jpg,42798,17707,Twitter for iPhone,https://t.co/YOC1fHFCSb,None
819004803107983360,2017-01-11 02:15:36,This is Bo. He was a very good First Doggo. 14/10 would be an absolute honor to pet https://t.co/AdPKrI8BZ1,14.0,10.0,Bo,Doggo,https://pbs.twimg.com/media/C12whDoVEAALRxa.jpg,82227,34370,Twitter for iPhone,https://t.co/AdPKrI8BZ1,standard_poodle
818627210458333184,2017-01-10 01:15:10,Meet Wafer. He represents every fiber of my being. 13/10 very good dog https://t.co/I7bkhxBxUG,13.0,10.0,Wafer,None,https://pbs.twimg.com/media/C1xZGkzWIAA8vh4.jpg,21123,7027,Twitter for iPhone,https://t.co/I7bkhxBxUG,Labrador_retriever
818614493328580609,2017-01-10 00:24:38,This is Bear. He's a passionate believer of the outdoors. Leaves excite him. 12/10 would hug softly https://t.co/FOF0hBDxP8,12.0,10.0,Bear,None,https://pbs.twimg.com/media/C1xNgraVIAA3EVb.jpg,9258,2343,Twitter for iPhone,https://t.co/FOF0hBDxP8,Chihuahua
818536468981415936,2017-01-09 19:14:36,This is Tom. He's a silly dog. Known for his unconventional swing style. One h*ck of a sneaky tongue slip too. 11/10 would push https://t.co/6fSVcn9HAU,11.0,10.0,Tom,None,https://pbs.twimg.com/media/C1wGkYoVQAAuC_O.jpg,10213,2261,Twitter for iPhone,https://t.co/6fSVcn9HAU,Welsh_springer_spaniel
818259473185828864,2017-01-09 00:53:55,This is Florence. He saw the same snap you sent him on your story. Pretty pupset with you. 12/10 https://t.co/rnkvT2kvib,12.0,10.0,Florence,None,https://pbs.twimg.com/media/C1sKo_QUkAALtkw.jpg,10349,2070,Twitter for iPhone,https://t.co/rnkvT2kvib,miniature_schnauzer
818145370475810820,2017-01-08 17:20:31,This is Autumn. Her favorite toy is a cheeseburger. She takes it everywhere. 11/10 https://t.co/JlPug12E5Z,11.0,10.0,Autumn,None,https://pbs.twimg.com/media/C1qi26rW8AMaj9K.jpg,11561,2356,Twitter for iPhone,https://t.co/JlPug12E5Z,golden_retriever
817827839487737858,2017-01-07 20:18:46,This is Buddy. He ran into a glass door once. Now he's h*ckin skeptical. 13/10 empowering af (vid by Brittany Gaunt) https://t.co/q2BgNIi3OA,13.0,10.0,Buddy,None,https://pbs.twimg.com/ext_tw_video_thumb/817827663108771841/pu/img/e9oi839RGWJR37jF.jpg,48311,24968,Twitter for iPhone,https://t.co/q2BgNIi3OA,cocker_spaniel
817777686764523521,2017-01-07 16:59:28,"This is Dido. She's playing the lead role in ""Pupper Stops to Catch Snow Before Resuming Shadow Box with Dried Apple."" 13/10 (IG: didodoggo) https://t.co/m7isZrOBX7",13.0,10.0,Dido,Multiple,https://pbs.twimg.com/ext_tw_video_thumb/817777588030476288/pu/img/KbuLpE4krHF4VdPf.jpg,10182,2511,Twitter for iPhone,https://t.co/m7isZrOBX7,curly-coated_retriever
817536400337801217,2017-01-07 01:00:41,"Say hello to Eugene &amp; Patti Melt. No matter how dysfunctional they get, they will never top their owners. Both 12/10 would pet at same time https://t.co/jQUdvtdYMu",12.0,10.0,Eugene,None,https://pbs.twimg.com/media/C1h4_MEXUAARxQF.jpg,11065,2714,Twitter for iPhone,https://t.co/jQUdvtdYMu,pug
817423860136083457,2017-01-06 17:33:29,This is Ken. His cheeks are magic. 13/10 (IG: ken_shiba) https://t.co/btzf1zTDeQ,13.0,10.0,Ken,None,https://pbs.twimg.com/ext_tw_video_thumb/817423809049493505/pu/img/5OFW0yueFu9oTUiQ.jpg,31683,13507,Twitter for iPhone,https://t.co/btzf1zTDeQ,Samoyed
817415592588222464,2017-01-06 17:00:38,"Meet Strudel. He's rather h*ckin pupset that your clothes clash. 11/10 click the link to see how u can help Strudel

https://t.co/3uxgLz8d0l https://t.co/O0ECL1StB2",11.0,10.0,Strudel,None,https://pbs.twimg.com/media/C1gLJVpWgAApI3r.jpg,5269,884,Twitter for iPhone,https://t.co/3uxgLz8d0l https://t.co/O0ECL1StB2,Doberman
817171292965273600,2017-01-06 00:49:53,This is Tebow. He kindly requests that you put down the coffee and play with him. 13/10 such a good boy https://t.co/56uBP28eqw,13.0,10.0,Tebow,None,https://pbs.twimg.com/media/C1cs8uAWgAEwbXc.jpg,8263,1856,Twitter for iPhone,https://t.co/56uBP28eqw,golden_retriever
817120970343411712,2017-01-05 21:29:55,Name a more iconic quartet... I'll wait. 13/10 for all https://t.co/kCLgD8687T,13.0,10.0,None,None,https://pbs.twimg.com/media/C1b_LSYUsAAJ494.jpg,11481,2400,Twitter for iPhone,https://t.co/kCLgD8687T,Saluki
817056546584727552,2017-01-05 17:13:55,This is Chloe. She fell asleep at the wheel. Absolute menace on the roadways. Sneaky tongue slip tho. 11/10 https://t.co/r6SLVN2VUH,11.0,10.0,Chloe,None,https://pbs.twimg.com/media/C1bEl4zVIAASj7_.jpg,8098,1509,Twitter for iPhone,https://t.co/r6SLVN2VUH,kelpie
816816676327063552,2017-01-05 01:20:46,This is Timber. He misses Christmas. Specifically the presents part. 12/10 cheer pup Timber https://t.co/dVVavqpeF9,12.0,10.0,Timber,None,https://pbs.twimg.com/media/C1XqbhXXUAElpfI.jpg,9432,1882,Twitter for iPhone,https://t.co/dVVavqpeF9,malamute
816697700272001025,2017-01-04 17:27:59,This is Binky. She appears to be rather h*ckin cozy. Nifty leg cross as well. 12/10 would snug well https://t.co/WFt82XLyEF,12.0,10.0,Binky,None,https://pbs.twimg.com/media/C1V-K63UAAEUHqw.jpg,9189,2040,Twitter for iPhone,https://t.co/WFt82XLyEF,Chihuahua
816450570814898180,2017-01-04 01:05:59,Meet Moose. He doesn't want his friend to go back to college. 13/10 looks like you're staying home John https://t.co/LIhmM7i70k,13.0,10.0,Moose,None,https://pbs.twimg.com/media/C1SddosXUAQcVR1.jpg,28499,7411,Twitter for iPhone,https://t.co/LIhmM7i70k,None
816336735214911488,2017-01-03 17:33:39,This is Dudley. He found a flower and now he's a queen. 11/10 would be an honor to pet https://t.co/nuJxtmlLcY,11.0,10.0,Dudley,None,https://pbs.twimg.com/media/C1Q17WdWEAAjKFO.jpg,8137,1793,Twitter for iPhone,https://t.co/nuJxtmlLcY,Labrador_retriever
816091915477250048,2017-01-03 01:20:49,This is Comet. He's a Wild Estonian Poofer. Surprised they caught him. 12/10 would pet well https://t.co/tlfuZ25IMi,12.0,10.0,Comet,None,https://pbs.twimg.com/media/C1NXQ6NXUAEAxIQ.jpg,8452,1976,Twitter for iPhone,https://t.co/tlfuZ25IMi,Pomeranian
815990720817401858,2017-01-02 18:38:42,"Meet Jack. He's one of the rare doggos that doesn't mind baths. 11/10 click the link to see how you can help Jack!

https://t.co/r4W111FzAq https://t.co/fQpYuMKG3p",11.0,10.0,Jack,None,https://pbs.twimg.com/media/C1L7OVVWQAIQ6Tt.jpg,4673,941,Twitter for iPhone,https://t.co/r4W111FzAq https://t.co/fQpYuMKG3p,Chihuahua
815966073409433600,2017-01-02 17:00:46,Here's a pupper with squeaky hiccups. Please enjoy. 13/10 https://t.co/MiMKtsLN6k,13.0,10.0,None,Pupper,https://pbs.twimg.com/ext_tw_video_thumb/815965888126062592/pu/img/JleSw4wRhgKDWQj5.jpg,21027,7822,Twitter for iPhone,https://t.co/MiMKtsLN6k,Tibetan_mastiff
815736392542261248,2017-01-02 01:48:06,This is Akumi. It's his birthday. He received many lickable gifts. 11/10 happy h*ckin birthday https://t.co/gd9UlLOCQ0,11.0,10.0,Akumi,None,https://pbs.twimg.com/media/C1IT6rVXUAIvwYT.jpg,9266,2105,Twitter for iPhone,https://t.co/gd9UlLOCQ0,Border_collie
815639385530101762,2017-01-01 19:22:38,This is Titan. His nose is quite chilly. Requests to return to the indoors. 12/10 would boop to warm https://t.co/bLZuOh9sKy,12.0,10.0,Titan,None,https://pbs.twimg.com/media/C1G7sXyWIAA10eH.jpg,7775,1547,Twitter for iPhone,https://t.co/bLZuOh9sKy,German_shepherd
815390420867969024,2017-01-01 02:53:20,Happy New Year from the squad! 13/10 for all https://t.co/9njRxyUd5L,13.0,10.0,None,None,https://pbs.twimg.com/media/C1DZQiTXgAUqgRI.jpg,9769,3547,Twitter for iPhone,https://t.co/9njRxyUd5L,None
814986499976527872,2016-12-31 00:08:17,This is Cooper. Someone attacked him with a sharpie. Poor pupper. 11/10 nifty tongue slip tho https://t.co/01vpuRDXQ8,11.0,10.0,Cooper,Pupper,https://pbs.twimg.com/media/C09p5dJWIAE5qKL.jpg,7222,1183,Twitter for iPhone,https://t.co/01vpuRDXQ8,dalmatian
814638523311648768,2016-12-30 01:05:33,This is Olivia. She's a passionate advocate of candid selfies. 12/10 would boop shnoop https://t.co/0LdNjoiNbv,12.0,10.0,Olivia,None,https://pbs.twimg.com/media/C04taUjWIAA6Mo4.jpg,10637,2513,Twitter for iPhone,https://t.co/0LdNjoiNbv,golden_retriever
814530161257443328,2016-12-29 17:54:58,This is Alf. Someone just rubbed a balloon on his head. He's only a little pupset about it. 12/10 would pet well https://t.co/IOdgfnSE9G,12.0,10.0,Alf,None,https://pbs.twimg.com/media/C03K2-VWIAAK1iV.jpg,8184,1731,Twitter for iPhone,https://t.co/IOdgfnSE9G,miniature_poodle
814153002265309185,2016-12-28 16:56:16,This is Oshie. He's ready to party. Bought that case himself. 12/10 someone tell Oshie it's Wednesday morning https://t.co/YIJo7X7K9J,12.0,10.0,Oshie,None,https://pbs.twimg.com/media/C0xz04SVIAAeyDb.jpg,27093,8062,Twitter for iPhone,https://t.co/YIJo7X7K9J,golden_retriever
813910438903693312,2016-12-28 00:52:25,This is Chubbs. He dug a hole and now he's stuck in it. Dang h*ckin doggo. 11/10 would assist https://t.co/z1VRj1cYZf,11.0,10.0,Chubbs,Doggo,https://pbs.twimg.com/media/C0uXObSXUAAIzmV.jpg,8808,1724,Twitter for iPhone,https://t.co/z1VRj1cYZf,Siberian_husky
813812741911748608,2016-12-27 18:24:12,"Meet Gary, Carrie Fisher's dog. Idk what I can say about Gary that reflects the inspirational awesomeness that was Carrie Fisher. 14/10 RIP https://t.co/uBnQTNEeGg",14.0,10.0,Gary,None,https://pbs.twimg.com/media/C0s-XtzWgAAp1W-.jpg,34441,12982,Twitter for iPhone,https://t.co/uBnQTNEeGg,French_bulldog
813800681631023104,2016-12-27 17:36:16,This is Sky. She's learning how to roll her R's. 12/10 cultured af https://t.co/OuaVvVkwJ1,12.0,10.0,Sky,None,https://pbs.twimg.com/media/C0szZh_XUAAm9je.jpg,7846,1638,Twitter for iPhone,https://t.co/OuaVvVkwJ1,malamute
813217897535406080,2016-12-26 03:00:30,Here is Atlas. He went all out this year. 13/10 downright magical af https://t.co/DVYIZOnO81,13.0,10.0,Atlas,None,https://pbs.twimg.com/media/C0khWkVXEAI389B.jpg,17583,6815,Twitter for iPhone,https://t.co/DVYIZOnO81,Samoyed
813202720496779264,2016-12-26 02:00:11,Here's a doggo who has concluded that Christmas is entirely too bright. Requests you tone it down a notch. 11/10 https://t.co/cD967DjnIn,11.0,10.0,None,Doggo,https://pbs.twimg.com/media/C0kTjqIXgAAqpRi.jpg,8730,1699,Twitter for iPhone,https://t.co/cD967DjnIn,cocker_spaniel
813187593374461952,2016-12-26 01:00:05,We only rate dogs. Please don't send in other things like this very good Christmas tree. Thank you... 13/10 https://t.co/rvSANEsQZJ,13.0,10.0,None,None,https://pbs.twimg.com/media/C0kFzOQUoAAt6yb.jpg,18721,4026,Twitter for iPhone,https://t.co/rvSANEsQZJ,golden_retriever
813172488309972993,2016-12-26 00:00:03,This is Eleanor. She winks like she knows many things that you don't. 12/10 https://t.co/bxGwkJa2kE,12.0,10.0,Eleanor,None,https://pbs.twimg.com/media/C0j4EESUsAABtMq.jpg,8761,1798,Twitter for iPhone,https://t.co/bxGwkJa2kE,golden_retriever
813157409116065792,2016-12-25 23:00:08,This is Layla. It is her first Christmas. She got to be one of the presents. 12/10 I wish my presents would bark https://t.co/hwhCbhCjnV,12.0,10.0,Layla,None,https://pbs.twimg.com/media/C0jqVVOXUAAGJ0G.jpg,7339,2058,Twitter for iPhone,https://t.co/hwhCbhCjnV,Pembroke
813142292504645637,2016-12-25 22:00:04,Everybody stop what you're doing and look at this dog with her tiny Santa hat. 13/10 https://t.co/KK4XQK9SPi,13.0,10.0,None,None,https://pbs.twimg.com/media/C0jcmOKVQAAd0VR.jpg,8041,2234,Twitter for iPhone,https://t.co/KK4XQK9SPi,beagle
813127251579564032,2016-12-25 21:00:18,Here's an anonymous doggo that appears to be very done with Christmas. 11/10 cheer up pup https://t.co/BzITyGw3JA,11.0,10.0,None,Doggo,https://pbs.twimg.com/media/C0jO6aBWEAAM28r.jpg,11157,2908,Twitter for iPhone,https://t.co/BzITyGw3JA,Norwegian_elkhound
813112105746448384,2016-12-25 20:00:07,Meet Toby. He's pupset because his hat isn't big enough. Christmas is ruined. 12/10 it'll be ok Toby https://t.co/zfdaGZlweq,12.0,10.0,Toby,None,https://pbs.twimg.com/media/C0jBJZVWQAA2_-X.jpg,9753,2551,Twitter for iPhone,https://t.co/zfdaGZlweq,Pembroke
813096984823349248,2016-12-25 19:00:02,This is Rocky. He got triple-doggo-dared. Stuck af. 11/10 someone help him https://t.co/soNL00XWVu,11.0,10.0,Rocky,Doggo,https://pbs.twimg.com/media/C0izZULWgAAKD-F.jpg,9976,3362,Twitter for iPhone,https://t.co/soNL00XWVu,Great_Dane
813081950185472002,2016-12-25 18:00:17,This is Baron. He's officially festive as h*ck. Thinks it's just a fancy scarf. 11/10 would pat head approvingly https://t.co/PjulYEXTvg,11.0,10.0,Baron,None,https://pbs.twimg.com/media/C0ilsa1XUAEHK_k.jpg,9382,2581,Twitter for iPhone,https://t.co/PjulYEXTvg,Doberman
813066809284972545,2016-12-25 17:00:08,This is Tyr. He is disgusted by holiday traffic. Just trying to get to Christmas brunch on time. 12/10 hurry up pup https://t.co/syuTXARdtN,12.0,10.0,Tyr,None,https://pbs.twimg.com/media/C0iX8OOVEAEIpMC.jpg,7508,1821,Twitter for iPhone,https://t.co/syuTXARdtN,toy_terrier
813051746834595840,2016-12-25 16:00:16,This is Bauer. He had nothing to do with the cookies that disappeared. 13/10 very good boy https://t.co/AIMF8ouzvl,13.0,10.0,Bauer,None,https://pbs.twimg.com/media/C0iKPZIXUAAbDYV.jpg,19834,6811,Twitter for iPhone,https://t.co/AIMF8ouzvl,golden_retriever
812781120811126785,2016-12-24 22:04:54,This is Swagger. He's the Cleveland Browns ambassador. Hype as h*ck after that first win today. 10/10 https://t.co/lXFM1l22bG,10.0,10.0,Swagger,None,https://pbs.twimg.com/media/C0eUHfWUAAANEYr.jpg,7121,1780,Twitter for iPhone,https://t.co/lXFM1l22bG,bull_mastiff
812709060537683968,2016-12-24 17:18:34,This is Brandi and Harley. They are practicing their caroling for later. Both 12/10 festive af https://t.co/AbBDuGZUpp,12.0,10.0,Brandi,None,https://pbs.twimg.com/media/C0dSk98WEAALyya.jpg,6264,1347,Twitter for iPhone,https://t.co/AbBDuGZUpp,Irish_setter
812503143955202048,2016-12-24 03:40:19,"I'm happy to inform you all that Jake is in excellent hands. 13/10 for him and his new family 
https://t.co/LRCTJpnCnS https://t.co/wZz7fI6XO1",13.0,10.0,None,None,https://pbs.twimg.com/media/C0aXTLqXEAADxBi.jpg,5718,1145,Twitter for iPhone,https://t.co/LRCTJpnCnS https://t.co/wZz7fI6XO1,None
812466873996607488,2016-12-24 01:16:12,This is Mary. She's desperately trying to recreate her Coachella experience.   12/10 downright h*ckin adorable https://t.co/BAJrfPvtux,12.0,10.0,Mary,None,https://pbs.twimg.com/media/C0Z2T_GWgAAxbL9.jpg,7541,1795,Twitter for iPhone,https://t.co/BAJrfPvtux,Great_Dane
812372279581671427,2016-12-23 19:00:19,This is Moe. He's a fetty woof. Got a cardboard cutout of himself for Christmas. 13/10 inspirational af https://t.co/gCnAeL2mvT,13.0,10.0,Moe,None,https://pbs.twimg.com/media/C0YgO3DW8AAz98O.jpg,12873,3406,Twitter for iPhone,https://t.co/gCnAeL2mvT,golden_retriever
811985624773361665,2016-12-22 17:23:53,Say hello to Ted. He accidentally opened the front facing camera. 11/10 h*ckin unpupared https://t.co/sIB5C6FDop,11.0,10.0,Ted,None,https://pbs.twimg.com/media/C0TAnZIUAAAADKs.jpg,6875,1303,Twitter for iPhone,https://t.co/sIB5C6FDop,Staffordshire_bullterrier
811744202451197953,2016-12-22 01:24:33,This is Halo. She likes watermelon. 13/10 https://t.co/TZkiQZqwA6,13.0,10.0,Halo,None,https://pbs.twimg.com/media/C0PlCQjXAAA9TIh.jpg,7120,1464,Twitter for iPhone,https://t.co/TZkiQZqwA6,Pekinese
811627233043480576,2016-12-21 17:39:46,This is Augie. He's a savage. Doesn't give a h*ck about your garden. Still 10/10 would forgive then pet https://t.co/IU8S0n4oxn,10.0,10.0,Augie,None,https://pbs.twimg.com/media/C0N6opSXAAAkCtN.jpg,12004,2831,Twitter for iPhone,https://t.co/IU8S0n4oxn,beagle
811386762094317568,2016-12-21 01:44:13,This is Craig. That's actually a normal sized fence he's stuck on. H*ckin massive pupper. 11/10 someone help him https://t.co/aAUXzoxaBy,11.0,10.0,Craig,Pupper,https://pbs.twimg.com/media/C0Kf9PtWQAEW4sE.jpg,19757,5942,Twitter for iPhone,https://t.co/aAUXzoxaBy,Pembroke
810984652412424192,2016-12-19 23:06:23,"Meet Sam. She smiles 24/7 &amp; secretly aspires to be a reindeer. 
Keep Sam smiling by clicking and sharing this link:
https://t.co/98tB8y7y7t https://t.co/LouL5vdvxx",24.0,7.0,Sam,None,https://pbs.twimg.com/media/C0EyPZbXAAAceSc.jpg,5029,1323,Twitter for iPhone,https://t.co/98tB8y7y7t https://t.co/LouL5vdvxx,golden_retriever
810896069567610880,2016-12-19 17:14:23,"This is Hunter. He just found out he needs braces. Requesting an orthodogtist stat. 11/10 you're fine Hunter, everything's fine https://t.co/zW1o0W4AYV",11.0,10.0,Hunter,None,https://pbs.twimg.com/media/C0DhpcrUAAAnx88.jpg,8484,1637,Twitter for iPhone,https://t.co/zW1o0W4AYV,flat-coated_retriever
810657578271330305,2016-12-19 01:26:42,This is Pavlov. His floatation device has failed him. He's quite pupset about it. 11/10 would rescue https://t.co/MXd0AGDsRJ,11.0,10.0,Pavlov,None,https://pbs.twimg.com/media/C0AIwgVXAAAc1Ig.jpg,10376,2456,Twitter for iPhone,https://t.co/MXd0AGDsRJ,malamute
810284430598270976,2016-12-18 00:43:57,This is Phil. He's a father. A very good father too. 13/10 everybody loves Phil https://t.co/9p6ECXJMMu,13.0,10.0,Phil,None,https://pbs.twimg.com/media/Cz61ZD4W8AAcJEU.jpg,33120,10449,Twitter for iPhone,https://t.co/9p6ECXJMMu,malamute
810254108431155201,2016-12-17 22:43:27,"This is Gus. He likes to be close to you, which is good because you want to be close to Gus. 12/10 would boop then pet https://t.co/DrsrQkEfnb",12.0,10.0,Gus,None,https://pbs.twimg.com/media/Cz6Z0DgWIAAfdvp.jpg,13900,3146,Twitter for iPhone,https://t.co/DrsrQkEfnb,Staffordshire_bullterrier
809920764300447744,2016-12-17 00:38:52,"Please only send in dogs. We only rate dogs, not seemingly heartbroken ewoks. Thank you... still 10/10 would console https://t.co/HIraYS1Bzo",10.0,10.0,None,None,https://pbs.twimg.com/media/Cz1qo05XUAQ4qXp.jpg,14714,3663,Twitter for iPhone,https://t.co/HIraYS1Bzo,Norwich_terrier
809448704142938112,2016-12-15 17:23:04,"I call this one ""A Blep by the Sea"" 12/10 https://t.co/EMdnCugNbo",12.0,10.0,None,None,https://pbs.twimg.com/media/Czu9RiwVEAA_Okk.jpg,6580,1360,Twitter for iPhone,https://t.co/EMdnCugNbo,Greater_Swiss_Mountain_dog
809220051211603969,2016-12-15 02:14:29,This is Kyro. He's a Stratocumulus Flop. Tongue ejects at random. Serious h*ckin condition. Still 12/10 would pet passionately https://t.co/wHu15q2Q6p,12.0,10.0,Kyro,None,https://pbs.twimg.com/media/CzrtWDbWEAAmIhy.jpg,18780,5220,Twitter for iPhone,https://t.co/wHu15q2Q6p,Pomeranian
809084759137812480,2016-12-14 17:16:53,"This is Wallace. You said you brushed your teeth but he checked your toothbrush and it was bone dry. 11/10 not pupset, just disappointed https://t.co/nadm8yWZ4h",11.0,10.0,Wallace,None,https://pbs.twimg.com/media/CzpyM41UoAE1b2w.jpg,12501,3275,Twitter for iPhone,https://t.co/nadm8yWZ4h,vizsla
808838249661788160,2016-12-14 00:57:20,This is Ito. He'll be your uber driver tonight. Currently adjusting the mirrors. 13/10 incredibly h*ckin responsible https://t.co/Zrrcw29o13,13.0,10.0,Ito,None,https://pbs.twimg.com/media/CzmSFlKUAAAQOjP.jpg,9614,2852,Twitter for iPhone,https://t.co/Zrrcw29o13,Rottweiler
808733504066486276,2016-12-13 18:01:07,Here's a pupper in a onesie. Quite pupset about it. Currently plotting revenge. 12/10 would rescue https://t.co/xQfrbNK3HD,12.0,10.0,None,Pupper,https://pbs.twimg.com/media/Czky0v9VIAEXRkd.jpg,7459,2027,Twitter for iPhone,https://t.co/xQfrbNK3HD,toy_poodle
808501579447930884,2016-12-13 02:39:32,This is Koda. He dug a hole and then sat in it because why not. Unamused by the bath that followed. 12/10 https://t.co/SQhyqrr8px,12.0,10.0,Koda,None,https://pbs.twimg.com/media/Czhf4XtVQAAIqpd.jpg,10707,2444,Twitter for iPhone,https://t.co/SQhyqrr8px,Airedale
808106460588765185,2016-12-12 00:29:28,Here we have Burke (pupper) and Dexter (doggo). Pupper wants to be exactly like doggo. Both 12/10 would pet at same time https://t.co/ANBpEYHaho,12.0,10.0,None,Multiple,https://pbs.twimg.com/media/Czb4iFRXgAIUMiN.jpg,8353,2056,Twitter for iPhone,https://t.co/ANBpEYHaho,golden_retriever
808001312164028416,2016-12-11 17:31:39,This is Cooper. He likes to stick his tongue out at you and then laugh about it. 12/10 quite the jokester https://t.co/O9iGgvfuzl,12.0,10.0,Cooper,None,https://pbs.twimg.com/media/CzaY5UdUoAAC91S.jpg,11786,3287,Twitter for iPhone,https://t.co/O9iGgvfuzl,Labrador_retriever
807621403335917568,2016-12-10 16:22:02,This is Ollie Vue. He was a 3 legged pupper on a mission to overcome everything. This is very hard to write. 14/10 we will miss you Ollie https://t.co/qTRY2qX9y4,14.0,10.0,Ollie,Pupper,https://pbs.twimg.com/media/CzU_YVGUUAA3Xsd.jpg,13780,3367,Twitter for iPhone,https://t.co/qTRY2qX9y4,golden_retriever
807106840509214720,2016-12-09 06:17:20,This is Stephan. He just wants to help. 13/10 such a good boy https://t.co/DkBYaCAg2d,13.0,10.0,Stephan,None,https://pbs.twimg.com/ext_tw_video_thumb/807106774843039744/pu/img/8XZg1xW35Xp2J6JW.jpg,110960,51335,Twitter for iPhone,https://t.co/DkBYaCAg2d,Chihuahua
807010152071229440,2016-12-08 23:53:08,This is Lennon. He's a Boopershnoop Pupperdoop. Quite rare. Exceptionally pettable. 12/10 would definitely boop that shnoop https://t.co/fhgP6vSfhX,12.0,10.0,Lennon,None,https://pbs.twimg.com/media/CzMTcZoXUAEKqEt.jpg,12405,3611,Twitter for iPhone,https://t.co/fhgP6vSfhX,golden_retriever
806629075125202948,2016-12-07 22:38:52,"""Good afternoon class today we're going to learn what makes a good boy so good"" 13/10 https://t.co/f1h2Fsalv9",13.0,10.0,None,None,https://pbs.twimg.com/media/CzG425nWgAAnP7P.jpg,70200,32178,Twitter for iPhone,https://t.co/f1h2Fsalv9,cocker_spaniel
806542213899489280,2016-12-07 16:53:43,This is Waffles. He's concerned that the dandruff shampoo he just bought is faulty. 11/10 tragic af https://t.co/BCB87qUU0h,11.0,10.0,Waffles,None,https://pbs.twimg.com/media/CzFp3FNW8AAfvV8.jpg,9692,2206,Twitter for iPhone,https://t.co/BCB87qUU0h,vizsla
806219024703037440,2016-12-06 19:29:28,We only rate dogs. Please stop sending in non-canines like this Freudian Poof Lion. This is incredibly frustrating... 11/10 https://t.co/IZidSrBvhi,11.0,10.0,None,None,https://pbs.twimg.com/media/CzBD7MWVIAA5ptx.jpg,6111,1129,Twitter for iPhone,https://t.co/IZidSrBvhi,chow
805932879469572096,2016-12-06 00:32:26,This is Major. He put on a tie for his first real walk. Only a little crooked. Can also drool upwards. H*ckin talented. 12/10 https://t.co/Zcwr8LgoO8,12.0,10.0,Major,None,https://pbs.twimg.com/media/Cy8_qt0UUAAHuuN.jpg,7857,1792,Twitter for iPhone,https://t.co/Zcwr8LgoO8,Norwegian_elkhound
